{
  "schemaVersion": "1.0.0",
  "batchId": "breadth-first-007",
  "sourceLabel": "Contributor breadth-first build",
  "sourceAsOf": "2026-07-31",
  "items": [
    {
      "id": "land_source_esa_business",
      "name": "ESA Business Applications",
      "kind": "source_directory",
      "stageIds": ["stage_plan_design"],
      "categoryIds": ["cat_planning_geospatial"],
      "sectorIds": ["sector_distributed_energy_access"],
      "geographies": ["Africa", "Global"],
      "statusAsSubmitted": "Named in source register",
      "summaryAsSubmitted": "Programme source for satellite-enabled energy-access tools including VIDA.",
      "sourceDomains": ["business.esa.int"]
    },
    {
      "id": "land_source_climate_policy_initiative",
      "name": "Climate Policy Initiative",
      "kind": "source_directory",
      "stageIds": ["stage_finance_procure"],
      "categoryIds": ["cat_finance_procurement_underwriting"],
      "sectorIds": ["sector_markets_finance_carbon"],
      "geographies": ["Africa", "Global"],
      "statusAsSubmitted": "Named in source register",
      "summaryAsSubmitted": "Climate-finance research source used for Nithio coverage.",
      "sourceDomains": ["climatepolicyinitiative.org"]
    },
    {
      "id": "land_source_fcdo_devtracker",
      "name": "FCDO Development Tracker",
      "kind": "source_directory",
      "stageIds": ["stage_generate_store"],
      "categoryIds": ["cat_generation_storage_operations"],
      "sectorIds": ["sector_distributed_energy_access", "sector_generation_storage"],
      "geographies": ["Nigeria", "Africa"],
      "statusAsSubmitted": "Named in source register",
      "summaryAsSubmitted": "Programme source for the Solar Nigeria partner list.",
      "sourceDomains": ["devtracker.fcdo.gov.uk"]
    },
    {
      "id": "land_source_disrupt_africa",
      "name": "Disrupt Africa",
      "kind": "source_directory",
      "stageIds": [],
      "categoryIds": [],
      "sectorIds": ["sector_distributed_energy_access", "sector_markets_finance_carbon"],
      "geographies": ["Africa"],
      "statusAsSubmitted": "Named in source register",
      "summaryAsSubmitted": "Technology reporting source for African software companies.",
      "sourceDomains": ["disruptafrica.com"]
    },
    {
      "id": "land_source_ecg_ghana",
      "name": "Electricity Company of Ghana",
      "kind": "source_directory",
      "stageIds": ["stage_transmit_distribute", "stage_meter_serve"],
      "categoryIds": ["cat_distribution_utility_operations", "cat_retail_metering_billing_payments"],
      "sectorIds": ["sector_power_utilities"],
      "geographies": ["Ghana"],
      "statusAsSubmitted": "Named in source register",
      "summaryAsSubmitted": "Utility source for Ghana software and deployment research.",
      "sourceDomains": ["ecg.com.gh"]
    },
    {
      "id": "land_source_forbes_middle_east",
      "name": "Forbes Middle East",
      "kind": "source_directory",
      "stageIds": [],
      "categoryIds": [],
      "sectorIds": ["sector_power_utilities", "sector_distributed_energy_access"],
      "geographies": ["North Africa", "Middle East"],
      "statusAsSubmitted": "Named in source register",
      "summaryAsSubmitted": "Business reporting source used in company research.",
      "sourceDomains": ["forbesmiddleeast.com"]
    },
    {
      "id": "land_source_iea",
      "name": "International Energy Agency",
      "kind": "source_directory",
      "stageIds": ["stage_plan_design"],
      "categoryIds": ["cat_planning_geospatial", "cat_engineering_design_simulation"],
      "sectorIds": ["sector_power_utilities", "sector_generation_storage"],
      "geographies": ["Africa", "Global"],
      "statusAsSubmitted": "Named in source register",
      "summaryAsSubmitted": "Energy-system data and modelling source.",
      "sourceDomains": ["iea.org"]
    },
    {
      "id": "land_source_intellinews",
      "name": "bne IntelliNews",
      "kind": "source_directory",
      "stageIds": ["stage_trade_report"],
      "categoryIds": ["cat_trading_wheeling_settlement"],
      "sectorIds": ["sector_markets_finance_carbon"],
      "geographies": ["South Africa", "Africa"],
      "statusAsSubmitted": "Named in source register",
      "summaryAsSubmitted": "News source used for South African market research.",
      "sourceDomains": ["intellinews.com"]
    },
    {
      "id": "land_source_honeywell_investor",
      "name": "Honeywell Investor Relations",
      "kind": "source_directory",
      "stageIds": ["stage_transmit_distribute"],
      "categoryIds": ["cat_distribution_utility_operations", "cat_data_interoperability_security"],
      "sectorIds": ["sector_power_utilities"],
      "geographies": ["Africa", "Global"],
      "statusAsSubmitted": "Named in source register",
      "summaryAsSubmitted": "Company source for the SparkMeter software-asset acquisition.",
      "sourceDomains": ["investor.honeywell.com"]
    },
    {
      "id": "land_source_kioi",
      "name": "Kioi",
      "kind": "source_directory",
      "stageIds": ["stage_meter_serve", "stage_trade_report"],
      "categoryIds": ["cat_retail_metering_billing_payments", "cat_carbon_mrv_reporting"],
      "sectorIds": ["sector_distributed_energy_access", "sector_markets_finance_carbon"],
      "geographies": ["Kenya"],
      "statusAsSubmitted": "Named in source register",
      "summaryAsSubmitted": "Reporting source used for KOKO Networks research.",
      "sourceDomains": ["kioi.co.ke"]
    },
    {
      "id": "land_source_mercom_capital",
      "name": "Mercom Capital Group",
      "kind": "source_directory",
      "stageIds": ["stage_finance_procure"],
      "categoryIds": ["cat_finance_procurement_underwriting"],
      "sectorIds": ["sector_markets_finance_carbon", "sector_distributed_energy_access"],
      "geographies": ["Africa", "Global"],
      "statusAsSubmitted": "Named in source register",
      "summaryAsSubmitted": "Transaction-reporting source used for PEG Africa research.",
      "sourceDomains": ["mercomcapital.com"]
    },
    {
      "id": "land_source_microgrid_news",
      "name": "Microgrid News",
      "kind": "source_directory",
      "stageIds": ["stage_generate_store", "stage_meter_serve"],
      "categoryIds": ["cat_generation_storage_operations", "cat_paygo_minigrid_operations"],
      "sectorIds": ["sector_distributed_energy_access", "sector_generation_storage"],
      "geographies": ["Africa", "Global"],
      "statusAsSubmitted": "Named in source register",
      "summaryAsSubmitted": "Industry reporting source for mini-grid software.",
      "sourceDomains": ["microgridnews.com"]
    },
    {
      "id": "land_source_odyssey_procure",
      "name": "Odyssey Procure",
      "kind": "source_directory",
      "stageIds": ["stage_finance_procure"],
      "categoryIds": ["cat_finance_procurement_underwriting"],
      "sectorIds": ["sector_markets_finance_carbon", "sector_distributed_energy_access"],
      "geographies": ["Africa"],
      "statusAsSubmitted": "Named in source register",
      "summaryAsSubmitted": "Procurement-platform source for distributed-energy research.",
      "sourceDomains": ["procure.odyssey.energy"]
    },
    {
      "id": "land_source_yicai_global",
      "name": "Yicai Global",
      "kind": "source_directory",
      "stageIds": ["stage_meter_serve"],
      "categoryIds": ["cat_emobility_battery_networks"],
      "sectorIds": ["sector_emobility_batteries"],
      "geographies": ["Africa", "Global"],
      "statusAsSubmitted": "Named in source register",
      "summaryAsSubmitted": "Business reporting source used for e-mobility research.",
      "sourceDomains": ["yicaiglobal.com"]
    }
  ],
  "deploymentLeads": [],
  "relationships": []
}
