{
  "schemaVersion": "1.0.0",
  "batchId": "breadth-first-005",
  "sourceLabel": "Contributor breadth-first build",
  "sourceAsOf": "2026-07-31",
  "items": [
    {
      "id": "land_lead_wattnow",
      "name": "Wattnow",
      "kind": "research_lead",
      "stageIds": ["stage_meter_serve", "stage_generate_store"],
      "categoryIds": ["cat_ci_behind_meter", "cat_data_interoperability_security", "cat_forecasting_flexibility_der"],
      "sectorIds": ["sector_commercial_industrial", "sector_power_utilities", "sector_generation_storage"],
      "geographies": ["Tunisia", "Africa"],
      "statusAsSubmitted": "Funding amount not supplied",
      "summaryAsSubmitted": "Energy-management and analytics lead.",
      "sourceDomains": ["wattnow.io"],
      "sourceUrls": ["https://wattnow.io"],
      "segmentsAsSubmitted": ["C&I", "buildings"],
      "deliveryModelsAsSubmitted": ["cloud SaaS", "IoT"],
      "commercialModelAsSubmitted": "subscription",
      "africaUseAsSubmitted": "confirmed_deployment",
      "asOfDate": "2026-08-02"
    },
    {
      "id": "land_lead_webgram_smartmifin",
      "name": "WEBGRAM / SmartMifin",
      "kind": "research_lead",
      "stageIds": ["stage_finance_procure", "stage_meter_serve"],
      "categoryIds": ["cat_finance_procurement_underwriting", "cat_paygo_minigrid_operations"],
      "sectorIds": ["sector_markets_finance_carbon", "sector_distributed_energy_access"],
      "geographies": ["Senegal", "Africa"],
      "statusAsSubmitted": "Deployment breadth self-reported",
      "summaryAsSubmitted": "Finance and PAYGo management software lead.",
      "sourceDomains": []
    },
    {
      "id": "land_lead_gosolr",
      "name": "GoSolr",
      "kind": "research_lead",
      "stageIds": ["stage_generate_store", "stage_meter_serve"],
      "categoryIds": ["cat_generation_storage_operations", "cat_ci_behind_meter"],
      "sectorIds": ["sector_generation_storage", "sector_commercial_industrial"],
      "geographies": ["South Africa"],
      "statusAsSubmitted": "Named for South Africa depth",
      "summaryAsSubmitted": "Solar and energy-services software lead.",
      "sourceDomains": []
    },
    {
      "id": "land_lead_solarafrica",
      "name": "SolarAfrica",
      "kind": "research_lead",
      "stageIds": ["stage_finance_procure", "stage_generate_store", "stage_meter_serve"],
      "categoryIds": ["cat_finance_procurement_underwriting", "cat_generation_storage_operations", "cat_ci_behind_meter"],
      "sectorIds": ["sector_generation_storage", "sector_commercial_industrial", "sector_markets_finance_carbon"],
      "geographies": ["South Africa", "Africa"],
      "statusAsSubmitted": "Named for South Africa depth",
      "summaryAsSubmitted": "Commercial solar, finance and energy-services lead.",
      "sourceDomains": []
    },
    {
      "id": "land_lead_solarise_africa",
      "name": "Solarise Africa",
      "kind": "research_lead",
      "stageIds": ["stage_finance_procure", "stage_generate_store"],
      "categoryIds": ["cat_finance_procurement_underwriting", "cat_generation_storage_operations"],
      "sectorIds": ["sector_generation_storage", "sector_commercial_industrial", "sector_markets_finance_carbon"],
      "geographies": ["South Africa", "Africa"],
      "statusAsSubmitted": "Named as an Odyssey customer",
      "summaryAsSubmitted": "Commercial solar finance and asset-platform lead.",
      "sourceDomains": []
    },
    {
      "id": "land_lead_buypower_ng",
      "name": "BuyPower.ng",
      "kind": "research_lead",
      "stageIds": ["stage_meter_serve"],
      "categoryIds": ["cat_retail_metering_billing_payments"],
      "sectorIds": ["sector_power_utilities"],
      "geographies": ["Nigeria"],
      "statusAsSubmitted": "Independent vending aggregator; energy relevance described as partial",
      "summaryAsSubmitted": "Electricity-token and bill-payment software lead.",
      "sourceDomains": []
    },
    {
      "id": "land_lead_efactory_ng",
      "name": "eFactory.ng",
      "kind": "research_lead",
      "stageIds": ["stage_meter_serve"],
      "categoryIds": ["cat_retail_metering_billing_payments"],
      "sectorIds": ["sector_power_utilities"],
      "geographies": ["Nigeria"],
      "statusAsSubmitted": "Independent vending aggregator; energy relevance described as partial",
      "summaryAsSubmitted": "Electricity vending and bill-payment software lead.",
      "sourceDomains": []
    },
    {
      "id": "land_lead_vtu_ng",
      "name": "VTU.ng",
      "kind": "research_lead",
      "stageIds": ["stage_meter_serve"],
      "categoryIds": ["cat_retail_metering_billing_payments"],
      "sectorIds": ["sector_power_utilities"],
      "geographies": ["Nigeria"],
      "statusAsSubmitted": "Independent vending aggregator; energy relevance described as partial",
      "summaryAsSubmitted": "Electricity vending and bill-payment software lead.",
      "sourceDomains": []
    },
    {
      "id": "land_lead_paysmart_tn",
      "name": "Paysmart.tn",
      "kind": "research_lead",
      "stageIds": ["stage_meter_serve"],
      "categoryIds": ["cat_retail_metering_billing_payments"],
      "sectorIds": ["sector_power_utilities"],
      "geographies": ["Tunisia"],
      "statusAsSubmitted": "Energy relevance described as partial",
      "summaryAsSubmitted": "Utility bill-payment software lead.",
      "sourceDomains": []
    },
    {
      "id": "land_lead_flouci",
      "name": "Flouci",
      "kind": "research_lead",
      "stageIds": ["stage_meter_serve"],
      "categoryIds": ["cat_retail_metering_billing_payments"],
      "sectorIds": ["sector_power_utilities"],
      "geographies": ["Tunisia"],
      "statusAsSubmitted": "Energy relevance described as partial",
      "summaryAsSubmitted": "Fintech and utility bill-payment software lead.",
      "sourceDomains": []
    },
    {
      "id": "land_directory_afsia",
      "name": "AFSIA member directory",
      "kind": "source_directory",
      "parent": "Africa Solar Industry Association",
      "stageIds": [],
      "categoryIds": [],
      "sectorIds": ["sector_generation_storage", "sector_commercial_industrial"],
      "geographies": ["Africa"],
      "statusAsSubmitted": "Full member list not extracted in the submitted pass",
      "summaryAsSubmitted": "Directory lead for African solar organisations.",
      "sourceDomains": []
    },
    {
      "id": "land_directory_gogla",
      "name": "GOGLA member directory",
      "kind": "source_directory",
      "parent": "GOGLA",
      "stageIds": [],
      "categoryIds": [],
      "sectorIds": ["sector_distributed_energy_access"],
      "geographies": ["Africa", "Global"],
      "statusAsSubmitted": "Full member list not extracted in the submitted pass",
      "summaryAsSubmitted": "Directory lead for off-grid solar organisations.",
      "sourceDomains": []
    },
    {
      "id": "land_directory_clean_cooking_alliance",
      "name": "Clean Cooking Alliance member directory",
      "kind": "source_directory",
      "parent": "Clean Cooking Alliance",
      "stageIds": [],
      "categoryIds": [],
      "sectorIds": ["sector_distributed_energy_access", "sector_markets_finance_carbon"],
      "geographies": ["Africa", "Global"],
      "statusAsSubmitted": "Full member list not extracted in the submitted pass",
      "summaryAsSubmitted": "Directory lead for clean-cooking organisations and platforms.",
      "sourceDomains": []
    }
  ],
  "deploymentLeads": [],
  "relationships": []
}
